,Published,User,Comment,comment_trans,Positive,Negative,Neutral,Compound,comment_clean,klasifikasi,klasifikasi_bayes
310,2023-11-17T14:22:09Z,@Gilbert.Suhendra,"Hanya Kadrun sentimen Etnis Tionghoa yang tidak permasalahkan itu, Ya itu hak Mereka warga Aceh apa yang Terjadi, Mampus",Only Kadrun Chinese ethnic sentiment is not a problem yes that is the right of Acehnese what happened dead,0.095,0.275,0.63,-0.6486,only kadrun chinese ethnic sentiment is not a problem yes that is the right of acehnese what happened dead,Positif,Positif
311,2023-11-17T14:22:08Z,@kamaruzamankamarul7271,Warga Rohingya wajib dihantar kegaza bantu hamas perang melawan yahuddi dajjal laknatullah,Rohingya residents must be delivered by Hamas Hamas War against Yahuddi Antichrist Laknatullah,0.0,0.245,0.755,-0.5994,rohingya residents must be delivered by hamas hamas war against yahuddi antichrist laknatullah,Netral,Netral
312,2023-11-17T14:18:38Z,@wari4336,Kenapa harus pergi dari negara nya si,Why should you leave the country,0.0,0.194,0.806,-0.0516,why should you leave the countri,Netral,Netral
313,2023-11-17T14:16:37Z,@vieansalmadian5127,"bnyak orang malaysia yg koment tentng perilaku buruk pengungsi rohingya dinegaranya,kemudian orang aceh sendiri yamg sempat menerima pengungsi rohingya juga berkomentar demikian.. sebenarnya ada apa dengan pengungsi rohingya????",Many Malaysians who commented on the bad behavior of Rohingya refugees in their storage then the Acehnese themselves had time to accept Rohingya refugees also commented so  Actually whats up with Rohingya refugees ,0.065,0.111,0.824,-0.4329,many malaysians who commented on the bad behavior of rohingya refugees in their storage then the acehnese themselves had time to accept rohingya refugees also commented so actually whats up with rohingya refug,Negatif,Negatif
314,2023-11-17T14:16:29Z,@crazyfrogz9739,"Kasih bantuan tp suruh balik kekapalnya,jngan sampai penyesalan datang di kemudian hari,mantap warga aceh 👍👍👍👍",Give help but tell me to return to the catewater not until regret comes later on steady Acehnese citizens 👍👍👍👍,0.212,0.0,0.788,0.5924,give help but tell me to return to the catewater not until regret comes later on steady acehnese citizen,Positif,Positif
315,2023-11-17T14:10:42Z,@user-sk6ue8sf5v,Ya allah dah sih biarin merka d situ kasian 😢😢😢😢 gak tega liat anak2 nya 😭😭😭😭,O Allah let me let me be sorry 😢😢😢😢 cant bear to see the kids T,0.0,0.085,0.915,-0.0772,o allah let me let me be sorry cant bear to see the kids t,Negatif,Netral
316,2023-11-17T14:08:51Z,@UstadJoker-se4no,Siapa yg mngirim orang2 itu pemerintah nya di mna,Who sent the people the government in mna,0.0,0.0,1.0,0.0,who sent the people the government in mna,Netral,Netral
317,2023-11-17T14:06:07Z,@sopojarwo1471,akidah bobrok.,Bobrok creed,0.0,0.0,1.0,0.0,bobrok cr,Netral,Netral
318,2023-11-17T14:04:55Z,@sihmarwati2709,"Apakah kehadiran mereka,, itu akan membuat konflik baru di Aceh??",Is their presence  it will create a new conflict in Aceh ,0.142,0.18,0.678,-0.1431,is their presence it will create a new conflict in aceh,Positif,Netral
319,2023-11-17T14:04:08Z,@GilangRamdani-he7hb,Saya mendukung warga aceh,I support Acehnese citizens,0.574,0.0,0.426,0.4019,i support acehnese citizen,Netral,Netral
320,2023-11-17T14:03:06Z,@azriellmaulana9164,Kasihan sesama muslim,Poor Muslims,0.0,0.756,0.244,-0.4767,poor muslim,Negatif,Netral
321,2023-11-17T14:02:33Z,@ecoeco6316,"Menolak Rohingya,..itu warga Aceh yg cerdas.. Tdk mau menambah masalah di kemudian hari...( tdk jelas sampai kpn mrk)",Reject Rohingya  Thats a smart Acehnese  dont want to add problems in the future  unclear until mrk,0.111,0.272,0.617,-0.4445,reject rohingya thats a smart acehnese dont want to add problems in the future unclear until mrk,Positif,Positif
322,2023-11-17T14:02:22Z,@InDra-vp1py,Kepada pemerintah Aceh dan pusat khususnya . Apa yg dilakukan warga Aceh cukup alasan untuk menolak pengungsi Rohingya ..... Khusus buat pemerintah pusat saya sebagai manusia merekapun manusia dari pada pemerintah memberi izin bangsa Eropa dan Yahudi menetap di pulau Bali dan Jakarta yg sering kita dengar turis asing memukul bahkan ada yg membunuh mertuanya orang pribumi .... Lebih baik pemerintah pusat menerima penggungsi Rohingnya untuk tinggal di NKRI dari pada bangsa Eropa yg tak punya adat merusak harga diri bangsa dgn tingkah lakunya tak bermoral .... Kalau pemerintah Aceh punya alasan biarkan mereka berlabuh di Sumbar pesisir Selatan Painan karena masih banyak lahan untuk pengungsi Rohingya bertahan hidup ..,To the Government of Aceh and the central parts in particular What is done by Acehnese people is enough reasons to reject Rohingya refugees  specifically for my central government as humans they are human beings from the government to give European and Jewish permits to settle on the islands of Bali and Jakarta that we often hear foreign tourists hit even some Killing his mother in laws of indigenous people  it is better for the central government to accept Rohingnya refiners to live in the Republic of Indonesia rather than Europeans who do not have customs damaging the nations self esteem with their immoral behavior  if the Aceh government has a reason they let them be anchored in West Sumatra Pesisir Selatan Painan because there is still a lot of land for Rohingya refugees to survive ,0.055,0.067,0.878,-0.4401,to the government of aceh and the central parts in particular what is done by acehnese people is enough reasons to reject rohingya refugees specifically for my central government as humans they are human beings from the government to give european and jewish permits to settle on the islands of bali and jakarta that we often hear foreign tourists hit even some killing his mother in laws of indigenous people it is better for the central government to accept rohingnya refiners to live in the republic of indonesia rather than europeans who do not have customs damaging the nations self esteem with their immoral behavior if the aceh government has a reason they let them be anchored in west sumatra pesisir selatan painan because there is still a lot of land for rohingya refugees to surv,Positif,Positif
323,2023-11-17T13:56:44Z,@HaryantoKaliwadas-ut5iw,Usir sj .indonesia banyak orang miskin.kita LG beres beres buat rakyat indonesia.malah lu mau bikin bingng sj.mending kalo kamu di tolong ga nglunjak.kalo nglunjak apa malah ga bikin runyam.usir usir usir.,Drive out SJ Indonesia a lot of poor people We are settled for the people of Indonesia,0.0,0.171,0.829,-0.4767,drive out sj indonesia a lot of poor people we are settled for the people of indonesia,Negatif,Positif
324,2023-11-17T13:53:22Z,@riniauliaarifin06arifin96,Mukanya ko&#39; seperti muka orang Banglades yaaa,His face ko 39 like the face of a banglades,0.238,0.0,0.762,0.3612,his face ko like the face of a banglad,Netral,Netral
325,2023-11-17T13:50:47Z,@kelasonlinebro3273,"Minta Suaka ke Amerika dan Australia . Benua mereka luas, belajar rendah hati / tidak protes melulu. Bekerja di perkebunannya, perikanannya dengan tekun , anak anaknya biar dirawat para misionaris dan negara. Suatu saat pasti ada etnis Rohingya yg ikut pimpin negara. Contoh Inggris perdana menterinya punya darah India, Amerika ada Obama. <br>Jangan menyerah saudaraku .",Ask asylum to America and Australia Their continent is broad learning humbly  does not protest Working on his plantation his fisheries diligently their children to be treated by missionaries and the state One time there must be a Rohingya ethnic who joined the country For example the first British minister has Indian blood America is Obama br Dont give up my brother,0.028,0.0,0.972,0.1877,ask asylum to america and australia their continent is broad learning humbly does not protest working on his plantation his fisheries diligently their children to be treated by missionaries and the state one time there must be a rohingya ethnic who joined the country for example the first british minister has indian blood america is obama br dont give up my broth,Positif,Positif
326,2023-11-17T13:46:56Z,@ajengningrum4323,Belajar di Malaysia mereka berbuat anarkis menyerobot lahan dan rumah penduduk asli jangan biarkan mereka menetap lama. kalau sudah nyaman perlahan mereka ingin memilikinya dan menendang suku asli,Learning in Malaysia they do anarchist grabbing land and native houses do not let them settle for a long time when its comfortable they want to have it and kick the indigenous tribe,0.133,0.0,0.867,0.5574,learning in malaysia they do anarchist grabbing land and native houses do not let them settle for a long time when its comfortable they want to have it and kick the indigenous trib,Positif,Positif
327,2023-11-17T13:45:31Z,@ghjvhj8950,Kalau aceh mau seperti negara tetangga terimalah mereka  tapi ingat di kemudian hari mereka akan meraja lela setelah mereka ramai contoh di malaysia,If Aceh wants to be like a neighboring country accept them but remember later on they will rather relanting after they are crowded in Malaysia,0.139,0.0,0.861,0.3716,if aceh wants to be like a neighboring country accept them but remember later on they will rather relanting after they are crowded in malaysia,Positif,Positif
328,2023-11-17T13:44:06Z,@sinanggartullo31,"UDAH LAH ACEH, MEREKA ITU KETURUNAN LELUHURMU, LIHAT WAJAH MU, MIRIPKAN DENGAN ROHINGNYA",Already Aceh they are descendants of your ancestors look at your face similar to the Rohingnya,0.0,0.0,1.0,0.0,already aceh they are descendants of your ancestors look at your face similar to the rohingnya,Netral,Netral
329,2023-11-17T13:40:17Z,@syadidaaghnia3761,"Jangan ampe kaya palestina deh, emang membantu tu baik tapi seperlunya aja kalo ngelunjak si pulang aja sono",Dont be like Palestine it really helps but just as necessarily if you just go home just go home,0.095,0.076,0.829,0.1006,dont be like palestine it really helps but just as necessarily if you just go home just go hom,Positif,Positif
330,2023-11-17T13:39:56Z,@siholsibueaBUEA-dt2od,"Bagaikan buih dilautan,banyak tapi cerai berai,dan tak ubahnya sebuah hidangan yg diperebutkan dari segala penjuru...!",Like foam in the ocean many but divorced and like a dish that is contested from all directions ,0.249,0.0,0.751,0.6476,like foam in the ocean many but divorced and like a dish that is contested from all direct,Positif,Positif
331,2023-11-17T13:38:12Z,@dodimaha2261,"Ya Alloh, semoga Muslimin Rohingya terselamatkan, yang menganiaya semoga mendapat azab Alloh SWT. Aamiin. ❤",Yes Allah I hope the Rohingya Muslims will be saved who persecuted hopefully getting the punishment of Allah SWT Amen ❤,0.363,0.18,0.458,0.6808,yes allah i hope the rohingya muslims will be saved who persecuted hopefully getting the punishment of allah swt amen,Netral,Netral
332,2023-11-17T13:33:15Z,@maduamanahrimba217,"Tolonglah siapapun yg mampu dari pemerintahan atau masyarakat aceh atau siapa saja yg mampu.<br>Berilah tempat dan perlindungan, atau makanan dan minuman. Bila tujuanya memang aceh karena sesama muslim itu sudah benar, Kalau bukan orang muslim lalu siapa lagi yg akan menolong mereka....??<br><br>&quot;...kerjakanlah sholat, tunaikanlah zakat dan berikanlah pinjaman kepada Alloh pinjaman yg baik...<br>Kebaikan apa saja yg kamu perbuat untuk dirimu, niscaya kamu memperoleh (balasanya) nya disisi Alloh sebagai balasan yg paling baik &amp; yg paling besar pahalanya. Dan mohonlah ampunan kepada Alloh,sesungguhnya Alloh maha pengampun maha penyayang. (Bagian Qs. Al muzammil 20)",Help anyone who is able from government or the people of Aceh or anyone who is able br give a place and protection or food and drink If the goal is indeed Aceh because fellow Muslims are correct if not Muslims then who will help them   good  br What kindness you do for you surely you get the bald on the side of Allah as the best reply  amp the biggest reward And beg for forgiveness to Allah in fact Allah is the Supreme Pengkatun Most Merciful QS Al Muzammil 20,0.251,0.0,0.749,0.9802,help anyone who is able from government or the people of aceh or anyone who is able br give a place and protection or food and drink if the goal is indeed aceh because fellow muslims are correct if not muslims then who will help them good br what kindness you do for you surely you get the bald on the side of allah as the best reply amp the biggest reward and beg for forgiveness to allah in fact allah is the supreme pengkatun most merciful qs al muzammil,Positif,Positif
333,2023-11-17T13:33:15Z,@masitah1532,"baik juga tapi perlu di contoh malaysia kini kalah sama imigran yang slalu berusaha demi mendapat tempat menikahi warga tempatan.<br>sejinak jinak nya anak harimau kita tau itu binatang buas<br>senurut nurut nya manusia tentu kita tidak tau isi hatinya.<br>liat lah malaysia liat lah palestina.<br>boleh menolong atas dasar agama atau kemanusiaan<br>tapi hantar ke bangla lagi karna mereka sebenar nya sama ras budaya bahasa mau pun asal,usulnya.",good too but it needs to be in the example of Malaysia now losing to immigrants who always try to get a place to marry local residents  see Malaysia see Palestine,0.058,0.102,0.84,-0.3506,good too but it needs to be in the example of malaysia now losing to immigrants who always try to get a place to marry local residents see malaysia see palestin,Positif,Positif
334,2023-11-17T13:28:51Z,@helenarachelleiwakabessy5328,Sesama Islam kok ditolak...????🤣🤣🤣🤣,Fellow Muslims are rejected   🤣🤣🤣🤣,0.0,0.415,0.585,-0.644,fellow muslims are reject,Netral,Netral
335,2023-11-17T13:25:45Z,@candrakirana763,"Biadap kalian yg menolak pengungsi,",Bies those of you who refuse refugees,0.0,0.268,0.732,-0.296,bies those of you who refuse refug,Netral,Netral
336,2023-11-17T13:24:54Z,@HarisMawan,Biadab banget.. kan mereka tinggal di atur aja. Mereka kelaparan Dan di buru rezim miyanmar. Belum lagi tenggelam di laut,Really barbaric  they just set it out They are starving and in the hunt for the Miyanmar regime Not to mention drowning in the sea,0.0,0.101,0.899,-0.4215,really barbaric they just set it out they are starving and in the hunt for the miyanmar regime not to mention drowning in the sea,Positif,Positif
337,2023-11-17T13:20:41Z,@onesiforusdaniel8065,Suku Rohingya ini muslim. Koq tidak mendapatkan bantuan dan perhatian dari sesama muslim Indonesia ya 🤔,This Rohingya tribe is Muslim Why dont get help and attention from fellow Indonesian Muslims 🤔,0.0,0.131,0.869,-0.3089,this rohingya tribe is muslim why dont get help and attention from fellow indonesian muslim,Netral,Netral
338,2023-11-17T13:18:19Z,@iyob7167,"UNTUK PARA WARGA ACEH TOLONG TOLAK SELALU,sebab mereka terdampar adalah kesengajaan untuk datang ke indonesia,mereka akan menjajah bangsa...<br>Dari tahun 2011 ada yg terdampar ditolong,akhirnya mereka datang lagi datang lagi,karena sudab kolingan rohingya yg sudah di indonesia sama yg di sana,gak mungkin lah kalo hanya terdampar bisa terus terusan terdampar kalo bukan tujuan mereka ke indonesia,mereka nangis sedih dll hanya untuk membuat rakyat bangsa ini kasihan dan menolongnya dan tinggal di indonesia ini.<br><br><br>Jadi tolaklah selalu demi bangsa.<br><br><br>Contoh sudah banyak dari malaysia dan negara lain,akhirnya mereka membuat kota sendiri dan menguasai.",For Acehnese citizens please always reject because they are stranded is intentional to come to Indonesia they will colonize the nation  br From 2011 there was something stranded finally they came again because the Rohingya colan that had been in Indonesia is the same there it is impossible if only stranded can continue to be stranded if not their goal to Indonesia they cry sadly etc only to make the people of this nation feel sorry and help and live in Indonesia br br br  So always refuse for the sake of the nation,0.047,0.117,0.835,-0.749,for acehnese citizens please always reject because they are stranded is intentional to come to indonesia they will colonize the nation br from there was something stranded finally they came again because the rohingya colan that had been in indonesia is the same there it is impossible if only stranded can continue to be stranded if not their goal to indonesia they cry sadly etc only to make the people of this nation feel sorry and help and live in indonesia br br br so always refuse for the sake of the n,Negatif,Negatif
339,2023-11-17T13:17:04Z,@user-ry4sd4to4f,Bukan kita menolak tapi saya selaku warga aceh yg ada di malaysia udah tau bagaimna kelakuan mereka,Not we refuse but I as a Acehnese citizen in Malaysia already know how their behavior,0.1,0.0,0.9,0.1139,not we refuse but i as a acehnese citizen in malaysia already know how their behavior,Netral,Netral
340,2023-11-17T13:16:09Z,@DEADPOOL-qz4tn,Hati2... Kawatirkan kelangsungan hidup generasi kerabat keluarga anak cucumu sebangsa Indonesia,Be careful  worry about the survival of the generation of relatives of your childrens family of Indonesian grandchildren,0.074,0.135,0.791,-0.3182,be careful worry about the survival of the generation of relatives of your childrens family of indonesian grandchildren,Negatif,Negatif
341,2023-11-17T13:13:31Z,@Popjunkys,Suruh ke Papua aja😂😂😂,Just tell Papua😂😂😂,0.0,0.0,1.0,0.0,just tell papua,Netral,Netral
342,2023-11-17T13:11:33Z,@pia2025,Kenapa di tolak?  Meka kan lagi membutuh kan pertolongan..  Apa lagi meka agama muslim bukan kah itu sodara,Why is it rejected Meka is still requiring help  what else is that Muslim religion is not Sodara,0.117,0.143,0.739,-0.1531,why is it rejected meka is still requiring help what else is that muslim religion is not sodara,Netral,Netral
343,2023-11-17T13:10:14Z,@putragigi1389,Kasian bg di bantu la,Sorry for being helped la la,0.0,0.206,0.794,-0.0772,sorry for being helped la la,Negatif,Netral
344,2023-11-17T13:09:36Z,@lapagotimur2983,"Pemerintah Indonesia , Malaysia Brunei wajib tolong mereka,tak malu nanti di tolong orang kafir, kalau sifat mereka kurang baik, kan ada hustat kita yang hebat hebat , Abdul Somad dan teman teman, jangan hanya bantu sembako.biar tiap-tiap ibadah ada ceramah untuk mereka.",Indonesian government Malaysia Brunei must help them not ashamed later in the help of infidels if their nature is not good there is our great great hustle Abdul Somad and friends dont just help food they,0.419,0.046,0.535,0.9615,indonesian government malaysia brunei must help them not ashamed later in the help of infidels if their nature is not good there is our great great hustle abdul somad and friends dont just help food they,Positif,Positif
345,2023-11-17T13:01:34Z,@El-Ge,"Kalau orang Islam saja sudah tidak mau menolong orang Islam, lalu siapa lagi?",Even if Muslims dont want to help Muslims then who else,0.0,0.279,0.721,-0.357,even if muslims dont want to help muslims then who el,Netral,Netral
346,2023-11-17T12:59:10Z,@syarifazza0074,Masih puluhan mungkin tunduk pada penduduk setempat klo sudah ribuan mereka pasti merasa diatas angin ingin menguasai biasanya bikin resah masyarakat,Still dozens may be subject to the locals if thousands of them must feel that the wind wants to control usually makes the community uneasy,0.0,0.098,0.902,-0.3818,still dozens may be subject to the locals if thousands of them must feel that the wind wants to control usually makes the community uneasi,Negatif,Positif
347,2023-11-17T12:54:36Z,@nnnahgfdsaajytrr,nyasar ke Indonesia terus ya ..aga ngeri2 sedap nerima tamu luar.. selalu ke ingat cerita palistin😢😢,straying to Indonesia keep on yes  its horrified as delicious to receive outside guests  always to remember the story of Palistin😢😢,0.214,0.117,0.669,0.4404,straying to indonesia keep on yes its horrified as delicious to receive outside guests always to remember the story of palistin,Positif,Positif
348,2023-11-17T12:48:39Z,@BagusWisnu-kh1gp,"Gila hancur bisa aceh,imigrasi kemana ni,heran gw,termasuk costguard,koq gak ada.",Crazy destroyed can be Aceh where is immigration I am surprised including Costguard how come there isnt,0.093,0.273,0.634,-0.5719,crazy destroyed can be aceh where is immigration i am surprised including costguard how come there isnt,Negatif,Netral
349,2023-11-17T12:46:53Z,@fatkhurrozi1708,"Gara2 isu rohingnya di tindas di myanmar,aceh jadi sukarela nerima imigran gelap rohingnya....<br><br>Sekarang aceh jadi Myanmar yg menolak rohingnya, tapi tak sesadis myanmar.<br><br>Media boleh di percaya,tapi jgn 100%",Because the Rohing issue was acted in Myanmar Aceh became voluntarily receiving its Rohingnya illegal immigrants  br br Now Aceh is Myanmar who rejects its Rohingnya but not as sadistic as Myanmar br br The media may be trusted but dont 100,0.085,0.091,0.824,0.1901,because the rohing issue was acted in myanmar aceh became voluntarily receiving its rohingnya illegal immigrants br br now aceh is myanmar who rejects its rohingnya but not as sadistic as myanmar br br the media may be trusted but dont,Negatif,Negatif
350,2023-11-17T12:46:14Z,@iqbalrahmi1405,"Etnis biang kerok,,,dah di bantu bukan berterima kasih,malah melawan aturan petugas,lari,,,kalo mereka benar kenapa gak berani berkeras kepala di tempat tinggal mereka sendiri,,,sebagai kemanusiaan sudah di bantu,tapi kalo untuk menetap dengan keras kepala,semua negara menolak mereka,,,",Ethnic culprit  already helped not grateful instead fight the rules of the officers run  if they are right why do not dare to insist in their own residence  as humanity has been helped but if to settle hard head all countries reject them ,0.031,0.134,0.835,-0.6483,ethnic culprit already helped not grateful instead fight the rules of the officers run if they are right why do not dare to insist in their own residence as humanity has been helped but if to settle hard head all countries reject them,Positif,Positif
351,2023-11-17T12:45:46Z,@Gus-mj7gt,Ingat ketika mereka dibantai keji oleh vetnam. <br>Kenapa muslim dan muslim bukan saudara. <br>Yg kejam cina berkembang biak diindonesia dan menguasai ekonomi indonesia. <br>Kata ustad felixiuw bangsa cina itu yahudi timur.yg ga terasa akan menguasai tanah indonesia,Remember when they were slaughtered vicious by Vetnam br why Muslims and Muslims are not brothers br The cruel Chinese breed in Indonesia and control the Indonesian economy br The word ustad felixiuw is the Chinese people East Jews,0.0,0.145,0.855,-0.743,remember when they were slaughtered vicious by vetnam br why muslims and muslims are not brothers br the cruel chinese breed in indonesia and control the indonesian economy br the word ustad felixiuw is the chinese people east jew,Negatif,Negatif
352,2023-11-17T12:43:13Z,@ebhychadus7716,YA ALLAH SEMOGA SODARA2 KITA SEHAT2 SELALU DAN CPT DPT TEMPAT  YG LAYAK AMIN🤲🤲,O Allah I hope our sodara2 are always healthy and can get a decent place amen🤲🤲,0.337,0.0,0.663,0.6808,o allah i hope our sodara2 are always healthy and can get a decent place amen,Positif,Positif
353,2023-11-17T12:42:52Z,@empalbrewok5647,Sama aja ma yg skr lagi perang. Coba lu terima. Ntar jg sama blangsaknya 😂,Its the same as the one who is now war Try to accept Later it will be the same as the blangsnya 😂,0.095,0.142,0.764,-0.3182,its the same as the one who is now war try to accept later it will be the same as the blangsnya,Netral,Netral
354,2023-11-17T12:42:45Z,@user-vb8te7zw3o,Setuju usir indonesia cuma dijadikan pembuangan2 turis bawa masalah kyak di bali dipenuhi bule melarat minta2 semena2 .enjijikan ko mereka trasa di biarkan and ngelumjak adat istiadatt,Agreeing to kissed Indonesia only used as a disposal of tourists bringing problems in Bali filled with Caucasians to ask for arbitrary,0.195,0.105,0.7,0.3182,agreeing to kissed indonesia only used as a disposal of tourists bringing problems in bali filled with caucasians to ask for arbitrari,Positif,Netral
355,2023-11-17T12:40:43Z,@donpatumbur8652,"Dasar mereka kurang cerdas nih ,lain kali coba ganti indentitas dl .Bikin  KTP  Palestina baru datang langsung ke Jakarta pasti diterima ,dikasihkan rumah,sekolah dan RS khusus. Di pulau Jawa sj masih banyak tanah nganggur tuh, pasti dihibahkan.",Basic they are less intelligent next time try to replace the identity of the Palestinian ID card the new Palestinian comes directly to Jakarta it must be accepted given a house school and special hospitals On the island of Java SJ there is still a lot of unemployed land it must be donated,0.135,0.0,0.865,0.7584,basic they are less intelligent next time try to replace the identity of the palestinian id card the new palestinian comes directly to jakarta it must be accepted given a house school and special hospitals on the island of java sj there is still a lot of unemployed land it must be don,Positif,Positif
356,2023-11-17T12:34:46Z,@ChristianPrince21n,"Makanya harus hidup rukun dan damai dengn yg beda agama,,harus saling toleransi dgn yg beda agama, biar nga seperti ini...",Thats why you have to live in harmony and peace with different religions must tolerate each other with different religions so that it is not like this ,0.186,0.063,0.751,0.6237,thats why you have to live in harmony and peace with different religions must tolerate each other with different religions so that it is not like thi,Positif,Positif
357,2023-11-17T12:34:31Z,@vandhakenil,Takutnya kaya malasia,Fear of being like malasia,0.287,0.368,0.345,-0.1779,fear of being like malasia,Netral,Netral
358,2023-11-17T12:33:25Z,@yuliastyle1980,Kok di tolak kan seiman ha ha giliran klau dah nyebut beda agama demo deh sejuta umat itu lah diri mu😂😂😂,How come it is rejected in the faith of ha ha it is the turn if you mention the different religion of the demonstration of a million people you are yourself,0.241,0.088,0.67,0.5719,how come it is rejected in the faith of ha ha it is the turn if you mention the different religion of the demonstration of a million people you are yourself,Netral,Netral
