,Published,User,Comment,comment_trans,Positive,Negative,Neutral,Compound,comment_clean,klasifikasi,klasifikasi_bayes
646,2023-11-17T05:44:31Z,@AmalSholeh-bn4hn,"Masalahnya kalau mereka ttp berada di Myanmar mereka akan dibunuh. Jadi mereka lari mencari suaka. Tinggal bgmn pemerintah bisa dengan kekuasaan dan kekuatannya menyelesaikan masalah pengungsi rohingya di tingkat nasional maupun regional  untuk warga aceh, silakan diviralkan agar minimal pemda bisa bantu kasih solusi",The problem is that if they are in Myanmar they will be killed So they run away looking for asylum Only the government can be able to resolve the issue of Rohingya refugees at the national and regional levels for the people of Aceh please be visited so that at least the Regional Government can help give a solution,0.143,0.104,0.753,0.1779,the problem is that if they are in myanmar they will be killed so they run away looking for asylum only the government can be able to resolve the issue of rohingya refugees at the national and regional levels for the people of aceh please be visited so that at least the regional government can help give a solut,Netral,Positif
647,2023-11-17T05:44:00Z,@salmanman6771,Itu manusiawi namun untuk bertempat tinggal gak bisa krn nanti pasti ribut masalah lahan mana lagi biaya bikin rumah,Its humane but to reside it cant be because later it will be noisy where else is the cost of making a house,0.0,0.089,0.911,-0.2617,its humane but to reside it cant be because later it will be noisy where else is the cost of making a h,Netral,Netral
648,2023-11-17T05:43:50Z,@forsaken3132,"sudah tepat , jgn di terima , lebih baik lagi di genosida saja ,<br>bangsanya sendiri bangladesh ga menerima<br>Ras Parasit",Its right dont accept it even better in genocide br The nation himself is not accepting the parasitic race,0.125,0.188,0.688,-0.12,its right dont accept it even better in genocide br the nation himself is not accepting the parasitic rac,Positif,Positif
649,2023-11-17T05:43:42Z,@rahmat-un4od,Mana UNHCR ? PBB ? MYANMAR HARUS DI SANKSI BERAT TERBUKTI LALAI DAN GENOSIDA WARGANYA ...,Where is UNHCR UN Myanmar must be sanctioned proven to be negligent and the genocide of its citizens ,0.0,0.0,1.0,0.0,where is unhcr un myanmar must be sanctioned proven to be negligent and the genocide of its citizen,Netral,Netral
650,2023-11-17T05:43:28Z,@abdulkarimkarim7585,"Tolak  sangat berbahaya, ini bukan negara aceh,",Reject very dangerous this is not a country of Aceh,0.0,0.465,0.535,-0.7264,reject very dangerous this is not a country of aceh,Negatif,Netral
651,2023-11-17T05:42:55Z,@maryam22830,Boleh berbuat baik tp kalau terus terusan begini nanti lama lama kaya Palestina. Awal nya Palestina menampung Israel dgn baik eh malah di kuasain sepenuhnya,You can do good but if you continue to do this it will take a long time to take a long time like Palestine In the beginning Palestine accommodated Israel well eh even in the full Kuasain,0.197,0.0,0.803,0.7814,you can do good but if you continue to do this it will take a long time to take a long time like palestine in the beginning palestine accommodated israel well eh even in the full kuasain,Positif,Positif
652,2023-11-17T05:42:53Z,@no-xs4io,Masyaallah taruh kalimantan masih banyak hutan nganggur,MasyaAllah Put Kalimantan there are still many unemployed forests,0.0,0.0,1.0,0.0,masyaallah put kalimantan there are still many unemployed forest,Positif,Netral
653,2023-11-17T05:42:24Z,@restualam4405,Wkwkk selamat🎉,Wkwkk congratulations🎉,0.0,0.0,1.0,0.0,wkwkk congratul,Netral,Netral
654,2023-11-17T05:42:15Z,@bangtung13,Sangat invasif ayo lah Rohingya pertahankan hak kalian di negara asal kalian jangan kabur gitu,Very invasive lets Rohingya maintain your rights in your home country dont run away,0.0,0.0,1.0,0.0,very invasive lets rohingya maintain your rights in your home country dont run away,Positif,Netral
655,2023-11-17T05:41:50Z,@rizkisempara7588,"Yg bicara soal kemanusiaan itu sangat bagus..<br>Rohinya ini imigran dari bangladesh,di malaysia dia sudah semakin gila dan menjadi jadi buat onar....<br>Rohinya ini manusia yg tdk bisa bls budi dan berterimakasih !<br>Saya juga bingung ..<br>Mereka islam tapi adab mereka tidak ada.",Who talk about humanity is very good  br This spirit is immigrants from Bangladesh in Malaysia he has become more crazy and becomes for trouble  I am also confused  br They are Islam but their manners are not there,0.077,0.119,0.804,-0.2263,who talk about humanity is very good br this spirit is immigrants from bangladesh in malaysia he has become more crazy and becomes for trouble i am also confused br they are islam but their manners are not th,Positif,Positif
656,2023-11-17T05:41:31Z,@user-fx3bf3vs5c,Apa yg di lakukan saudara kt di aceh ini udah tepat jgn sampai warga rohingnya menetap di indonesia soalnya di malaysia aja makin lama tinggal makin menginjak org tempatan susah di atur,What is done by KT brother in Aceh is already right until the Rohing residents settled in Indonesia because in Malaysia the more lives more and more,0.0,0.0,1.0,0.0,what is done by kt brother in aceh is already right until the rohing residents settled in indonesia because in malaysia the more lives more and mor,Positif,Positif
657,2023-11-17T05:39:08Z,@imamsaipul6495,"Katanya serambi mekah,mayoritas islam semua,saatnya cari amal buat di aherat,ada muslim yg butuh bantuan mlh di sia siakan,percumah jd muslim,kl sesama muslim gk saling membantu,apa gk kasihan,",He said the porch of Mecca the majority of Muslims time to find charity for Aherat there are Muslims who need MLH assistance in Siakan to be Muslim KL fellow Muslims dont help each other is it not sorry,0.095,0.053,0.851,0.1935,he said the porch of mecca the majority of muslims time to find charity for aherat there are muslims who need mlh assistance in siakan to be muslim kl fellow muslims dont help each other is it not sorri,Negatif,Negatif
658,2023-11-17T05:39:02Z,@moehamad9690,Kasihan amat ya,Its a pity,0.0,0.688,0.312,-0.296,its a p,Netral,Netral
659,2023-11-17T05:38:21Z,@user-ci4dn3es1f,Diberi kerjaan saja mereka. Kssihan,Just given their work KSSIHAN,0.0,0.0,1.0,0.0,just given their work kssihan,Netral,Netral
660,2023-11-17T05:37:56Z,@kartika_jember77,jngn sampai di kuasai pengungsi negara kita. kasian sih kasian tpi lama2 di kuasai orang asing,Do not get to control of our countrys refugees sorry sorry but for a long time to be controlled by foreigners,0.0,0.113,0.887,-0.0772,do not get to control of our countrys refugees sorry sorry but for a long time to be controlled by foreign,Negatif,Negatif
661,2023-11-17T05:37:51Z,@gemakkipu1101,knp.kok ngungsi apa dinegaranya perang kah,why is it evacuing what is the war in the war,0.0,0.464,0.536,-0.8316,why is it evacuing what is the war in the war,Netral,Netral
662,2023-11-17T05:36:25Z,@aiyulee6366,Mending kasi mereka rumah menetap dripada kasi tanah ke investor rempang,Better for them home to settling Dripada Kasi Land to Rempang Investor,0.209,0.0,0.791,0.4404,better for them home to settling dripada kasi land to rempang investor,Positif,Netral
663,2023-11-17T05:36:07Z,@nanakristina6878,balikan ke laut ..jangan pernah terima pengungsi dari manapun . . hanya akan membebani INDONESIA SAJA,return to the sea  never accept refugees from anywhere  will only burden Indonesia,0.0,0.298,0.702,-0.6229,return to the sea never accept refugees from anywhere will only burden indonesia,Netral,Netral
664,2023-11-17T05:35:49Z,@Elisa-bq2jp,Mereka udah keenakan.. dipikirnya warga Aceh selalu menerima mereka... Kalo gak dibatasi bisa2 mereka menguasai Aceh,They are already comfortable  He thought that Acehnese people always accepted them  if not limited they could control Aceh,0.282,0.0,0.718,0.7241,they are already comfortable he thought that acehnese people always accepted them if not limited they could control aceh,Positif,Positif
665,2023-11-17T05:35:42Z,@gundalaputrapetir6558,Setuju juga dengan warga aceh mereka sudah membantu .dan jangan mentap . Jumplah yang banyak sekalih,Agree also with the people of Aceh they have helped And do not go to Jump a lot,0.135,0.0,0.865,0.3612,agree also with the people of aceh they have helped and do not go to jump a lot,Netral,Netral
666,2023-11-17T05:35:38Z,@muhtareffendi5214,Warga Aceh harus ada perikemanusiaan apalagi mereka se aqidah Agama Islam ......Bumi dan langit ciptaan Alloh...manusia sementara di Dunia.....😂🎉👍👋🤲🤲🤲,Acehnese people must have humanity especially since they are a aqeedah of Islam  Earth and the sky created by Allah  Humans while in the world  😂🎉👍👋🤲🤲🤲,0.069,0.0,0.931,0.25,acehnese people must have humanity especially since they are a aqeedah of islam earth and the sky created by allah humans while in the world,Netral,Positif
667,2023-11-17T05:35:17Z,@matgaber3317,"MENERIMA MEREKA TINGGAL BERSAMA KITA KERANA ALLAH. TAPI MEREKA TIDAK BERFIKIR BEGITU. LIHAT SAJA DI MAKAYSIA, WARGA. BANGLA, ROHINGNYA DAN LAIN² PELARIAN DITERIMA DENGAN BAIK. PADA AKHIRNYA MEREKA MENENTANG TUAN YANG MENERIMA MEREKA. UNDANG² DILANGGAR DAN PEMBUAT KOTOR. SAMPAH SARAP BUANG TIDAK BERTEMPAT. BAIK JUGA ACEH MENOLAK UNTUK MENERIMA MEREKA SUPAYA TIDAK TIMBUL MASALAH DI KEMUDIAN HARI.",Receive them to live with us because of God But they dont think so Just look at Makaysia residents Bangla the Rohingnya and other escapes were well received In the end they opposed the master who accepted them The invitation is violated and dirty makers Sarapi waste is not located Good Aceh also refused to accept them so that there was no problem in the future,0.133,0.27,0.597,-0.9372,receive them to live with us because of god but they dont think so just look at makaysia residents bangla the rohingnya and other escapes were well received in the end they opposed the master who accepted them the invitation is violated and dirty makers sarapi waste is not located good aceh also refused to accept them so that there was no problem in the futur,Negatif,Positif
668,2023-11-17T05:34:10Z,@hobbyfajrie,"membantu boleh, tp jgn menetap ujung2nya menguasai dan memerdekakan diri di tanah dan negara orang seperti negara Israel😅😅",Help may but dont stay in the edges control and liberate themselves in the land and countries of people like Israeli countries,0.203,0.0,0.797,0.6249,help may but dont stay in the edges control and liberate themselves in the land and countries of people like israeli countri,Netral,Netral
669,2023-11-17T05:34:01Z,@godblessyou3657,"masyarakat dsna tau menjaga wilayahnya,jgn sampai kyk negara jiran malaysia mereka bikin onar dsna,berbuat kriminal,memang tidak semuanya seperti itu tapi alangkah baiknya jgn diterima,krn warga aceh sudah cukup baik memberi bantuan,",Dsna people know to protect their territory do not until the neighboring Malaysian country is making dsna trouble committing criminal indeed not all like that but it would be nice not to be accepted because the people of Aceh are good enough to provide assistance,0.19,0.141,0.669,0.5682,dsna people know to protect their territory do not until the neighboring malaysian country is making dsna trouble committing criminal indeed not all like that but it would be nice not to be accepted because the people of aceh are good enough to provide assist,Positif,Positif
670,2023-11-17T05:33:44Z,@DedyElias-wn3fu,"Kasihan,  sya minta bpk prabowo  menolong  pengungsi rohingnya itu,",Poor I asked Mr Prabowo to help the Rohingnya refugees,0.211,0.242,0.547,-0.1027,poor i asked mr prabowo to help the rohingnya refug,Negatif,Netral
671,2023-11-17T05:33:35Z,@andriyansyah2477,"itu orang pakistan, yang ngerantau ke myanmar, balikin lagi ke pakistan.",It was Pakistani who won to Myanmar returned to Pakistan,0.291,0.0,0.709,0.5719,it was pakistani who won to myanmar returned to pakistan,Netral,Netral
672,2023-11-17T05:32:32Z,@adiw6283,"Terima saja dulu terus diskusikan dengan pemerintah pusat dan libatkan PBB yang ngurus masalah pengungsi, meskipun pada akhirnya di kembalikan ke negara asal itu soal nanti.<br><br>Bukan malah diusir suruh balik ke kapal terombang-ambing dilautan yang gak jelas arah tujuannya itu biadab, mereka itu manusia bukan binatang.",Just accept it first to discuss with the central government and involve the United Nations which takes care of refugee problems although in the end it is returned to the country of origin about later Its savage they are human beings,0.171,0.113,0.716,0.4404,just accept it first to discuss with the central government and involve the united nations which takes care of refugee problems although in the end it is returned to the country of origin about later its savage they are human b,Positif,Positif
673,2023-11-17T05:31:16Z,@ibupramitasari6996,"😢kasihan juga,,tp belajarlah dr palestina..😢",😢 Its also pity but learn from Palestine😢,0.0,0.186,0.814,-0.1531,its also pity but learn from palestin,Negatif,Netral
674,2023-11-17T05:31:12Z,@fina6700,Siapa tuch yg Masukin mereka ke Aceh.... Psti ada Bandar nya...,Who tuch who entered them into Aceh  there is a dealer ,0.0,0.0,1.0,0.0,who tuch who entered them into aceh there is a d,Netral,Netral
675,2023-11-17T05:31:08Z,@ronalpakpahan2845,Masa sesama muslim aja ngk mau bantu.. Kok Palestina mau kalian bantu,How come fellow Muslims dont want to help  how come you want to help Palestine,0.0,0.367,0.633,-0.6072,how come fellow muslims dont want to help how come you want to help palestin,Netral,Netral
676,2023-11-17T05:31:06Z,@isahsah618,RoHinah itu Mna sih,Rohinah is mna anyway,0.0,0.0,1.0,0.0,rohinah is mna anyway,Netral,Netral
677,2023-11-17T05:30:29Z,@junwatania1925,Katanya se iman,He said as faith,0.483,0.0,0.517,0.4215,he said as faith,Netral,Netral
678,2023-11-17T05:29:55Z,@ojikojik9468,Orang acheh menolak sekeras kerasnya imigran rohingya...kemana aparat...usir mereka.,The acheh people reject the hardness of the Rohingya immigrants  where are the authorities  Surround them,0.0,0.137,0.863,-0.4019,the acheh people reject the hardness of the rohingya immigrants where are the authorities surround them,Netral,Netral
679,2023-11-17T05:29:54Z,@tewahcity7073,Bukankah mereka semuanya muslim,Arent they all Muslim,0.0,0.0,1.0,0.0,arent they all muslim,Netral,Netral
680,2023-11-17T05:29:50Z,@Ahmad-li6pz,"Pengungsi Rohingya, di beri hati minta jantung,, gue sama sekali enggak respect, sama pengungsi Rohingya,,",Rohingya refugees given a heart asking for a heart  I did not respect at all with the Rohingya refugee ,0.0,0.131,0.869,-0.3724,rohingya refugees given a heart asking for a heart i did not respect at all with the rohingya refug,Netral,Netral
681,2023-11-17T05:29:38Z,@medan2951,Tolak pengungsi rohingya mereka bisa menjajah kita contoh nya Malaysia mereka merajalela di tanah Melayu dan membuat keonaran kepada rakyat Pribumi kalau mereka sudah kuat kita si jajah aceh sudah cukup banyak membantu pengungsi rohingya sebelumnya apa yang terjadi setelahnya mereka membuat keresahan dan keonaran di desa tempat penampungan tersebut,Rejecting Rohingya refugees they can colonize us for example Malaysia is rampant in the Malay land and makes trouble for the indigenous people that they are strong we are quite a lot of Rohingya refugees before what happened after they made anxiety and trouble in the village where the shelter,0.057,0.176,0.767,-0.7003,rejecting rohingya refugees they can colonize us for example malaysia is rampant in the malay land and makes trouble for the indigenous people that they are strong we are quite a lot of rohingya refugees before what happened after they made anxiety and trouble in the village where the shelt,Positif,Positif
682,2023-11-17T05:29:18Z,@Kirnoto99,Suruh ke Malaysia saja mereka biar kumpulan sama warganya yg di Malaysia soalnya kalau ditampung di Aceh mereka akan mengambil alih tanah penduduk dn mengklaim tanahnya mereka kalau sudah bertahun² mereka tinggal dn beranak pinak dn nantinya kaya di Thailand,Just tell Malaysia they can let the collection with their citizens in Malaysia because if they are accommodated in Aceh they will take over the land of the residents and claim their land when they have lived for years and they will be rich in Thailand in Thailand,0.071,0.0,0.929,0.5574,just tell malaysia they can let the collection with their citizens in malaysia because if they are accommodated in aceh they will take over the land of the residents and claim their land when they have lived for years and they will be rich in thailand in thailand,Positif,Positif
683,2023-11-17T05:29:18Z,@edrizalkoto6642,Jgn di perboleh kan menetap akan membahayakan rakyat aceh nantinya.,Do not be found will be harmful to the people of Aceh later,0.0,0.0,1.0,0.0,do not be found will be harmful to the people of aceh lat,Netral,Netral
684,2023-11-17T05:29:07Z,@sosorsaba2243,"swbaiknya ditsmpung orang orang yg kemaren demo di monas🤑, 1 orang menampung 1 keluarga dipastikan pengungsi rohingya makmur",Almighty the people who were demonstrated yesterday at Monas🤑 1 person accommodated 1 family,0.0,0.0,1.0,0.0,almighty the people who were demonstrated yesterday at monas person accommodated famili,Netral,Netral
685,2023-11-17T05:28:06Z,@jimirajimi2541,"Usir ajah, jngan sampai nantinya malah warga asli pribumi yg d usir.",Surround then until later the indigenous native citizens who are kicked out,0.0,0.0,1.0,0.0,surround then until later the indigenous native citizens who are kicked out,Netral,Netral
686,2023-11-17T05:27:28Z,@bergitalawi230,"Emang kenapa sama negara mereka sendiri ya, jd gk tega loh lihat anak anak yg msh di bawah umur astaga😢😢😢",Why are you the same as their own country so I cant bear to see children who are still under age,0.0,0.0,1.0,0.0,why are you the same as their own country so i cant bear to see children who are still under ag,Positif,Positif
687,2023-11-17T05:26:53Z,@Umardau_123,Indonesia ketua Asean hrus berani menekan Myanmar..<br><br><br>Sdih bgt Saudara sesama muslim di gtuin.<br>Hrusnya cri solusi,Indonesia Chairperson of ASEAN must dare to suppress Myanmar  br br,0.0,0.0,1.0,0.0,indonesia chairperson of asean must dare to suppress myanmar br br,Netral,Netral
688,2023-11-17T05:26:52Z,@senjumo,Mgknkah 100thn lg ACEH ganti nama jd ACEHRO ?,Is it 100th LG Aceh replace the name JD Acehro,0.0,0.0,1.0,0.0,is it th lg aceh replace the name jd acehro,Netral,Netral
689,2023-11-17T05:25:57Z,@user-lb5hp9tz8h,Enak banget main ngungsi dgn gampangny.. 😁<br>Dgn seringny memberi bantuan jd salah mnartikan,Really good to play evacuating easily  😁 br by often providing help so wrong,0.439,0.16,0.401,0.7154,really good to play evacuating easily br by often providing help so wrong,Positif,Positif
690,2023-11-17T05:25:32Z,@Umardau_123,Jika kita membantu. <br>Allah tidak akan sia2..,If we help br Allah will not be in vain ,0.359,0.0,0.641,0.6164,if we help br allah will not be in vain,Netral,Netral
691,2023-11-17T05:21:12Z,@musliadiadi8541,Mantap keren,Great cool,1.0,0.0,0.0,0.7506,great cool,Positif,Netral
692,2023-11-17T05:20:49Z,@khinzal,"saya sangat setuju di tolak,<br>soal di malaysia bnyak rohingya,<br>mereka di malaysia semena2,sudah dikasih tempat tinggal tpi semaunya jorok lagi,seharusnya sebagai pengungsi,atau perantau,dimana bumi dipijak disitu langit dijunjung",I strongly agree to rejected br about Malaysia the Rohingya they are in Malaysia arbitrarily they have been given a place to live they should be dirty they should be refugees or nomads where the earth is stepped on the sky is upheld,0.096,0.13,0.774,-0.3818,i strongly agree to rejected br about malaysia the rohingya they are in malaysia arbitrarily they have been given a place to live they should be dirty they should be refugees or nomads where the earth is stepped on the sky is upheld,Negatif,Negatif
693,2023-11-17T05:20:48Z,@anteko1232,daerah seperti Aceh memang sering menjadi tempat berlindung bagi pengungsi dari negara lain,areas like Aceh are often a shelter for refugees from other countries,0.2,0.0,0.8,0.3612,areas like aceh are often a shelter for refugees from other countri,Negatif,Netral
694,2023-11-17T05:19:35Z,@satiksatik6024,"Lama2 akan menguasai Aceh , memberontak dan mendirikan  pemerintahan sendiri ,pemerintah wajib curiga dan waspada dgn kedatangan rohingnya terus menerus ke Aceh jangan sampai menyesal di kemudian hari",For a long time they will control Aceh rebel and establish their own government the government must be suspicious and be aware of the continuous arrival of the Rohingnya to Aceh not to regret later,0.062,0.11,0.828,-0.1945,for a long time they will control aceh rebel and establish their own government the government must be suspicious and be aware of the continuous arrival of the rohingnya to aceh not to regret lat,Positif,Positif
695,2023-11-17T05:19:18Z,@putrakelanaputratanahmerah6857,Katanya SE iman 😂😂😂,He said as faith 😂😂😂,0.412,0.0,0.588,0.4215,he said as faith,Netral,Netral
696,2023-11-17T05:17:23Z,@anuarjamai1351,Bknkah hari tu mahu terima sangat kan,How come the day I really accept it right,0.292,0.0,0.708,0.4391,how come the day i really accept it right,Positif,Netral
697,2023-11-17T05:17:05Z,@jasroy2055,"Kpda saudara2 di indon..tolak warga ini dari duduk di indonesia..tolak baik2 dan jangan benarkan mereka turun ke tanah indon walau dimanapun..kmi dimlysia dah dpt pengajaran dri warga atau bangsa ini..mereka gunakan agama dan kopolosan muka mereka mulanya..sdngkn bila sdh lma..bru warga malaysia tahu mereka ini keislamannya seperti dibuat2..sampai nak klem dah bbrapa tmpt dimlysia..jd,lbih baik tolak awal2..menyesal sprti mlysia dah tk berguna nanti",To the brothers in indon  refused this citizen from sitting in Indonesia  refused well and do not be true they go down to the land of Indon even though  KMI Dimlysia has been able to teach from this citizen or this nation  they use their religion and the progress of their faces sdngkn if already lma  the citizens of Malaysians know they are Islam like being made  until you have to clamps I have been dimlysia  jd better to reject the beginning ,0.102,0.094,0.804,0.2187,to the brothers in indon refused this citizen from sitting in indonesia refused well and do not be true they go down to the land of indon even though kmi dimlysia has been able to teach from this citizen or this nation they use their religion and the progress of their faces sdngkn if already lma the citizens of malaysians know they are islam like being made until you have to clamps i have been dimlysia jd better to reject the begin,Positif,Positif
698,2023-11-17T05:16:51Z,@ekosugirilancarjaya8000,Contohlah palestine mereka ttp berthan dinegaranya sklipun nyawa taruhanny krn muslim sejati tdk tkut mati demi memperjuangkan kebenaran❤,For example Palestine but the berthan is in the same time as a bet because the true Muslim does not die to fight for the truth,0.394,0.0,0.606,0.928,for example palestine but the berthan is in the same time as a bet because the true muslim does not die to fight for the truth,Positif,Positif
699,2023-11-17T05:15:58Z,@MiaMia-nt3nw,Allah maha menyaksikan semua ini ..Hanya Allah yg bisa mengurus  semua,Allah is okay to witness all this  only Allah can take care of all,0.282,0.0,0.718,0.6249,allah is okay to witness all this only allah can take care of ,Positif,Netral
700,2023-11-17T05:15:36Z,@eerrbb6241,"Warga aceh sudah benar, hanya memberi perbekalan. Jangan memulai apa yang tidak bisa diselesaikan. Bagaimanapun tanah di Negara ini harus dipertahankan dari bangsa asing. Apalagi kalau negara yang bukan tujuan pengungsi. Apalagi ini yang secara ideologi, tatakrama dan sopan santunnya berbeda. Tidak semua niat baik akan berakhir baik. Daripada nanti tanahnya diklaim warga asing mending buat WNI sendiri yang masih banyak ngga punya tanah dan rumah tempat tinggal, WNI yang mau punya tanah aja mesti nyicil. Baik itu boleh, tolol jangan.",Acehnese residents are correct only giving supplies Dont start what cant be solved However land in this country must be maintained from foreign nations Especially if a country is not a refugee goal Moreover this is what ideologically manner and manners are different Not all good intentions will end well Instead of later the land is claimed to be better for foreign citizens who still have a lot of land and houses in residence Indonesian citizens who want to have land must be in installments Whether its okay stupid dont,0.109,0.078,0.813,0.2453,acehnese residents are correct only giving supplies dont start what cant be solved however land in this country must be maintained from foreign nations especially if a country is not a refugee goal moreover this is what ideologically manner and manners are different not all good intentions will end well instead of later the land is claimed to be better for foreign citizens who still have a lot of land and houses in residence indonesian citizens who want to have land must be in installments whether its okay stupid dont,Positif,Positif
701,2023-11-17T05:15:10Z,@nurullatifah4121,😢😢😢 melasi,😢😢😢 Melasi,0.0,0.0,1.0,0.0,melasi,Netral,Netral
702,2023-11-17T05:15:08Z,@andi_ananta,Katanyo saudara muslim...??<br>wkwkwk,KATANYO Muslim brothers   br wkwkwk,0.0,0.0,1.0,0.0,katanyo muslim brothers br wkwkwk,Netral,Netral
703,2023-11-17T05:13:44Z,@ahmadarif4042,entah apapun alasannya kita cuma merasa kasihan😢.semoga allah memberikan solusi terbaik buat mereka,whatever the reason we just feel sorry,0.0,0.178,0.822,-0.0772,whatever the reason we just feel sorri,Netral,Netral
704,2023-11-17T05:13:39Z,@royrebot3632,Trima donk kan  seiman 🎉,Thank you for the faith 🎉,0.57,0.0,0.43,0.6486,thank you for the faith,Netral,Netral
