,Published,User,Comment,comment_trans,Positive,Negative,Neutral,Compound,comment_clean,klasifikasi,klasifikasi_bayes
1073,2023-11-17T02:41:50Z,@ksatriyopiningit3496,"Kalo berbaik itu gak boleh pilih2..asal ia makhluk hidup ya bantu dong..jangan kalo palestina yg islam dan masih ada etnis arabnya dibantu dibela-belain mati2an,tapi kalo orang2 bangsa lain yg tak islam dan tak bebau ke arab2-an dicuekin dido&#39;ain ke neraka saja sana loe..manusia model apa sampeyan itu kok gak adil gitu..ya itulah akibatnya jika jiwa2 anak2 manusia yg telah dijajah oleh yg namanya agama..jadi buta dan dibutakan segala akal pikir naluri dan nuraninya!",If you are good you cant choose  it is a living creature please help  dont have a Palestinian of Islam and there are still Arabic ethnic groups assisted by death but if other nations who are not Islam and do not go to Arabi2s are ignored Dido  39 Ain just go to hell there you  what model is that the model is not fair  thats the result if the souls of human children who have been colonized by the name of religion  so blind and blinded all reason thinking of their instincts and conscience,0.048,0.169,0.783,-0.9503,if you are good you cant choose it is a living creature please help dont have a palestinian of islam and there are still arabic ethnic groups assisted by death but if other nations who are not islam and do not go to arabi2s are ignored dido ain just go to hell there you what model is that the model is not fair thats the result if the souls of human children who have been colonized by the name of religion so blind and blinded all reason thinking of their instincts and consci,Negatif,Negatif
1074,2023-11-17T02:41:45Z,@yanu3778,the local have rights too...,The local have rights too ,0.0,0.0,1.0,0.0,the local have rights too,Netral,Netral
1075,2023-11-17T02:41:36Z,@dens6981,Ah saudara seiman ga bermoral masa d tolak...azab dan murka akan menimpa 😂,Ah brothers and sisters in the faithful morals when refrained  the punishment and wrath will befall 😂,0.131,0.145,0.724,-0.0772,ah brothers and sisters in the faithful morals when refrained the punishment and wrath will bef,Netral,Netral
1076,2023-11-17T02:41:02Z,@lilirosmawita1054,Ngak usah d terima nantik kayak yahudi pula...jafi penjajah,No need to accept it like a Jewish too  Jafi invaders,0.333,0.144,0.523,0.4404,no need to accept it like a jewish too jafi invad,Netral,Netral
1077,2023-11-17T02:40:56Z,@imanoz9132,Kasian lho diusir mrk orang muslim yg ditindas jg Ya Robb... Riskan jg tp kalo harus tinggal,Sorry you know they were kicked out by Muslims who were oppressed too Robb  risky too but if you have to stay,0.0,0.187,0.813,-0.3818,sorry you know they were kicked out by muslims who were oppressed too robb risky too but if you have to stay,Negatif,Negatif
1078,2023-11-17T02:40:48Z,@dandysumatha,"warga aceh memiliki pengalaman buruk dengan orang rohingya ini, keras kepala, terlalu banyak menuntut, tidak menghargai kultur dan budaya setempat dan yang parah kerap melecehkan wanita wanita aceh disana... mungkin inilah yang membuat warga aceh enggan menerima pengungsi dari etis ini kembali.... mereka anehnya memilih negara makmur kaya walau gak seiman seperti australia dan selandia baru daripada negara seperti malaysia dan indonesia yang seiman...",Acehnese have a bad experience with this Rohingya stubborn demanding too much disrespecting local culture and culture and that is severe often harassing Acehnese women there  Maybe this is what makes Acehnese people reluctant to accept refugees from ethical again   They are strangely choosing a prosperous country even though not in the faith like Australia and New Zealand rather than countries like Malaysia and Indonesia in the faith ,0.15,0.248,0.602,-0.7943,acehnese have a bad experience with this rohingya stubborn demanding too much disrespecting local culture and culture and that is severe often harassing acehnese women there maybe this is what makes acehnese people reluctant to accept refugees from ethical again they are strangely choosing a prosperous country even though not in the faith like australia and new zealand rather than countries like malaysia and indonesia in the faith,Negatif,Positif
1079,2023-11-17T02:39:26Z,@adnan_saputra,Kasih lawan transmigrasi biar dibangun lahan lahan kosong,Love for transmigration opponents so that vacant land is built,0.318,0.0,0.682,0.6369,love for transmigration opponents so that vacant land is built,Positif,Netral
1080,2023-11-17T02:39:04Z,@johnngle3009,waspada itu penting ..jangan di kasih hati minta ampela lagi ..... rakyat indo udah lbh dr 278jt jangan tampung mereka nambahin beban negara,alert is important  dont be given hearts asking for gizzard again  the people of Indo have been more than 278 million dont accommodate the burden on the country,0.192,0.0,0.808,0.6604,alert is important dont be given hearts asking for gizzard again the people of indo have been more than million dont accommodate the burden on the countri,Positif,Positif
1081,2023-11-17T02:38:59Z,@kudupiye8282,boycot produk2 myanmar,Boycot Myanmar products,0.0,0.0,1.0,0.0,boycot myanmar product,Netral,Netral
1082,2023-11-17T02:38:29Z,@karmuji2598,Iya tolak ajah suruh pulang ajah ke negaranya d indonesia dah banyak penduduknya 🤣🤔,Yes reject tell me to go home to his country in Indonesia there are many residents 🤣🤔,0.132,0.132,0.735,0.0,yes reject tell me to go home to his country in indonesia there are many resid,Positif,Positif
1083,2023-11-17T02:38:13Z,@calonmualaf7305,nah tuh kan.... negara mayoritas muslim aja gak bisa menerima pengungsi muslim.... gaya mau bela palestina.... gimana kalo pengungsi palestina datang ke Indonesia...??? masih mau bela....??? 🤣🤣🤣🤣,Well right  the majority of Muslim countries cant accept Muslim refugees  Style Want to Defend Palestine  What if Palestinian refugees come to Indonesia   Still want to defend   🤣🤣🤣🤣,0.146,0.056,0.798,0.3561,well right the majority of muslim countries cant accept muslim refugees style want to defend palestine what if palestinian refugees come to indonesia still want to defend,Positif,Positif
1084,2023-11-17T02:38:11Z,@chotian,Semua karena israHell kn pd trauma kalo nerima pengungsi takutnya malah ngambil alih kaya di Palestina,All because of Israhell KN PD trauma if you accept the refugees they are afraid that they will take over rich in Palestine,0.214,0.097,0.69,0.5267,all because of israhell kn pd trauma if you accept the refugees they are afraid that they will take over rich in palestin,Negatif,Positif
1085,2023-11-17T02:38:09Z,@karangsamudera2743,"sesama muslim jgn gtu, mau rohingnya, palestina, yaman, suriah, terima aja, kan saudara se iman, gmn sih. coba kirim ke bandung pasti cocok, sesama kadrun. 😊😊",Fellow Muslims dont dont want the Rohing Palestine Yemen Syria just accept it right siblings how come Try sending to Bandung definitely suitable fellow Kadrun 😊😊,0.219,0.0,0.781,0.6667,fellow muslims dont dont want the rohing palestine yemen syria just accept it right siblings how come try sending to bandung definitely suitable fellow kadrun,Positif,Positif
1086,2023-11-17T02:37:56Z,@muhammadimron4007,Awal mula... Penduduk asli bakal terusir jika menetap,The beginning  the indigenous people will be driven out if settled,0.0,0.0,1.0,0.0,the beginning the indigenous people will be driven out if settl,Netral,Netral
1087,2023-11-17T02:37:38Z,@viktoriawonga3258,Indonesia pun  susah....,Indonesia is difficult ,0.0,0.455,0.545,-0.3612,indonesia is difficult,Negatif,Netral
1088,2023-11-17T02:37:09Z,@aninaning9835,Setuju tolak sj jangan sampai macam di malaysia sekarang malah susah di atur,Agree to Reject SJ not to get kind of in Malaysia now it is difficult to set,0.115,0.24,0.645,-0.4019,agree to reject sj not to get kind of in malaysia now it is difficult to set,Positif,Netral
1089,2023-11-17T02:36:28Z,@mamaschannel5634,Itu kenapa semua rohingya ke aceh ya....kenapa ga ke sulawesi kalimantan atau papua,Thats why all Rohingya go to Aceh  Why not to Sulawesi Kalimantan or Papua,0.0,0.0,1.0,0.0,thats why all rohingya go to aceh why not to sulawesi kalimantan or papua,Netral,Netral
1090,2023-11-17T02:35:40Z,@timasitohang5607,"Mantap Warga Aceh drpd beban hidup bagi warga Aceh lebih disuruh pergi pulang ke negaranya , kita pun susah sekarang semua mahal tambah lagi ratusan , warga Aceh hrs Tegas",Steady people of Aceh DrPd the burden of living for Acehnese people is more told to go back to their country we are also difficult now all expensive added the people of Aceh must be firm,0.0,0.137,0.863,-0.6597,steady people of aceh drpd the burden of living for acehnese people is more told to go back to their country we are also difficult now all expensive added the people of aceh must be firm,Negatif,Positif
1091,2023-11-17T02:35:36Z,@tanakachanel3480,Semoga Aceh di landa bencana aminnn,Hopefully Aceh in the Aminnn Disaster,0.25,0.38,0.37,-0.34,hopefully aceh in the aminnn disast,Netral,Netral
1092,2023-11-17T02:35:17Z,@dedenzsuparman5685,"Saya rasa itu bijak..klw mendarat kita bantu apa kbutuhan mreka, krna mreka juga manusia,tp klw menetap itu tdk di benarkan,,,",I think its wise  if we land we help what they are because they are also human but if you are settled it is not justified ,0.127,0.094,0.78,0.0034,i think its wise if we land we help what they are because they are also human but if you are settled it is not justifi,Positif,Positif
1093,2023-11-17T02:35:09Z,@user-tc4tw3un8i,"Kasian sekali mereka,,,mereka tidak d akui d negaranya karena beragama muslim yg mayoritas warganya beragama budha",Very sorry for them  they did not admit the country because of Muslim religion the majority of its citizens were Buddhist,0.0,0.137,0.863,-0.2926,very sorry for them they did not admit the country because of muslim religion the majority of its citizens were buddhist,Negatif,Negatif
1094,2023-11-17T02:34:53Z,@rastapoenya7669,Mana warga aceh yg dlu sambut dg cinta pengungsi rohingya... Sampe2 dsuruh tggl selamanya😂 asikkkkk😂😂😂,Where are the people of Aceh who will welcome with the love of Rohingya refugees  until all of the Tggl Forever😂 ASIKKKKKKKKKKKK,0.255,0.0,0.745,0.802,where are the people of aceh who will welcome with the love of rohingya refugees until all of the tggl forever asikkkkkkkkkkkk,Positif,Positif
1095,2023-11-17T02:34:33Z,@irwansetiawan2553,beda perlakuan kalau yg datang dari yaman...🤭,Different treatment if you come from Yemen  🤭,0.0,0.0,1.0,0.0,different treatment if you come from yemen,Netral,Netral
1096,2023-11-17T02:34:31Z,@jouagalib5286,maha suci Allah yg lebih mengetahuinya ..pertanyaannya kenapa sebagai pemimpin Indonesia TDK menerimah saudara se agamanya .padahal dia org yg di tindas di negaranya .di karenakan pemimpinnya bukan org muslim .dan segala cara dia dfitna oleh org org kafir .kenapa perintah Islam di Indonesia ini TDK mau menerimanya. apakah pemimpin skrg bukan Islam ..soal ancaman dr luar untuk apa kita takut .kalau kita benar .soal kematian sudah pasti dan TDK bisa ada yg menghindar dr kematian .apa yg bisa engkau melemat dr sakratal maut dan di kubur ..melebihi di akhirat .akhirat itu masih jauh bangat .. astaghfirullah..banyak betul di kuasai manusia oleh iblis laknatullah. ..lebih tinggi ke inginan dunianya dr PD akhirat ..lupa .bahwa Sanya dunia hanya 60 tahun kita huni klu beruntun .akhirat untuk selama lamanya..Bingin pemimpin Islam skrg .hanya mau di kata di karenakan jabatannya yg tinggi .lup lg bahwa jabatan itu Allah yg menghendaki mu . subhanallah,All Holy God knows more  the question is why as an Indonesian leader does not accept your brothers and sisters In fact he is the person who was opposed in his country Because his leader is not a Muslim And all the way he is dicitna by the infidel person This doesnt want to accept it whether the leader is not Islam  the threat of the outside for what we are afraid If we are right The end of death is certain and there is no one who avoids death What can you do from the sakratal death and in the grave  more than in the hereafter The hereafter is still far away  Astaghfirullah  Many are very well controlled by humans by the devil laknatullah  higher to his world of world than the hereafter  that is that the world is only 60 years old we live in a row Thats God who wants you Subhan Allah,0.047,0.17,0.784,-0.9716,all holy god knows more the question is why as an indonesian leader does not accept your brothers and sisters in fact he is the person who was opposed in his country because his leader is not a muslim and all the way he is dicitna by the infidel person this doesnt want to accept it whether the leader is not islam the threat of the outside for what we are afraid if we are right the end of death is certain and there is no one who avoids death what can you do from the sakratal death and in the grave more than in the hereafter the hereafter is still far away astaghfirullah many are very well controlled by humans by the devil laknatullah higher to his world of world than the hereafter that is that the world is only years old we live in a row thats god who wants you subhan allah,Positif,Positif
1097,2023-11-17T02:34:25Z,@srihartatirusdi1837,"Dinegeri sebelah....atas dasar kemanusiaan mereka diterima (dahulu), tapi yg terjadi sekarang  mereka berusaha dan berani mengklaim kawasan2/daerah2 tertentu untuk mereka duduki. Yang parahnya mereka berani kepada yg punya rumah. Semoga kita bisa belajar dari apa yg sudah terjadi disebelah.",In the next door  on the basis of their humanity is accepted formerly but what happens now they try and dare to claim certain regionsregions for them to sit on Whats worse they dare to have a house Hopefully we can learn from what has happened next,0.141,0.076,0.783,0.3818,in the next door on the basis of their humanity is accepted formerly but what happens now they try and dare to claim certain regionsregions for them to sit on whats worse they dare to have a house hopefully we can learn from what has happened next,Negatif,Positif
1098,2023-11-17T02:33:41Z,@susipinyuh7099,Ngapa di tolak .<br>Itu saudara kita,Why is it rejected br Thats our brother,0.0,0.32,0.68,-0.5106,why is it rejected br thats our broth,Netral,Netral
1099,2023-11-17T02:33:40Z,@muhammadrukman7123,"Bravo Pemda Aceh . Jika mereka menetap , di kemudian tahun akan membahaya kan dan merugi kan khusus nya Pemda Aceh dan umum nya Pemerintahan Indonesia .",Bravo Aceh Regional Government If they settled in the future the year will harm and loss specifically the Aceh Regional Government and the general government of the Indonesian government,0.0,0.177,0.823,-0.7003,bravo aceh regional government if they settled in the future the year will harm and loss specifically the aceh regional government and the general government of the indonesian govern,Positif,Positif
1100,2023-11-17T02:33:34Z,@anakdesa6482,Bener ..kasih bantuan bis itu surih lnjutkn perjlanan,Really  thanks for the help of the bus surih lnjutkn jlasan,0.37,0.0,0.63,0.7076,really thanks for the help of the bus surih lnjutkn jlasan,Positif,Netral
1101,2023-11-17T02:33:26Z,@sapusapuan9671,Nanti kalau di sini jajah,Later if its here,0.0,0.0,1.0,0.0,later if its h,Netral,Netral
1102,2023-11-17T02:33:02Z,@JulioDossantos-uy7op,Banyak negara Muslim hidup dengan konflik terutama ras dan sbgnya.,Many Muslim countries live with conflicts especially races and as they are,0.0,0.191,0.809,-0.3818,many muslim countries live with conflicts especially races and as they ar,Positif,Positif
1103,2023-11-17T02:32:44Z,@hasniangsana1294,Nanti masuk Malaysia pula ni..tak tahulah macamana negara Malaysia nak menghalang mereka..dah beratus ribu dah di Malaysia..habis negeri mereka dah jajah dan semua pekerjaan dah dibolot oleh mereka termasuk pasar2 besar di Malaysia....warga Aceh mengambil keputusan yang tepat bagi menggelak menerima nasib seperti Malaysia,Later in Malaysia this is also a kind of Malaysian country I will block them  I will get thousands of thousands in Malaysia  after their country has been justified and all the work has been fired by them including large markets in Malaysia  Acehnese citizens make decisions which is right for holding a fate like Malaysia,0.083,0.104,0.813,-0.3182,later in malaysia this is also a kind of malaysian country i will block them i will get thousands of thousands in malaysia after their country has been justified and all the work has been fired by them including large markets in malaysia acehnese citizens make decisions which is right for holding a fate like malaysia,Positif,Positif
1104,2023-11-17T02:32:37Z,@pawaeasomin2613,Nyanyi bela paletane pas saudara muslim lain terdampar di usir mana uhua islam,Singing Bela Paletane when other Muslim brothers were stranded on the expelt from Uhua Islam,0.0,0.0,1.0,0.0,singing bela paletane when other muslim brothers were stranded on the expelt from uhua islam,Negatif,Negatif
1105,2023-11-17T02:32:30Z,@hanirorayi9275,Warga sendiri susah.....<br>HEBAT ACEH......<br>PENGUNGSI DIBERI BEKAL....<br>Smoga sejahtera warga Aceh....,Residents themselves are difficult  great Aceh  br refugees are given provisions  br Hopefully the prosperity of Acehnese citizens ,0.24,0.088,0.671,0.6486,residents themselves are difficult great aceh br refugees are given provisions br hopefully the prosperity of acehnese citizen,Positif,Positif
1106,2023-11-17T02:32:09Z,@DoaAulia-ij4yj,Masya allah aceh😭 tolong lah aceh engkau lah yg ada mudah rizki sampaykje makkah. Suku lain banyak di indo tapi masa alah menolong telur asin tak kan mns,Mashallah Aceh got please Aceh you are the ones who are easy for Rizki Makkah There are many other tribes in Indo but the time is helping salted eggs not MNS,0.186,0.0,0.814,0.6597,mashallah aceh got please aceh you are the ones who are easy for rizki makkah there are many other tribes in indo but the time is helping salted eggs not mn,Positif,Positif
1107,2023-11-17T02:32:04Z,@eddykof8958,"Udah pada sadar warga Aceh., Menerima pengungsi Rohingya sama sama saja mendatangkan masalah untuk mereka sendiri",Already aware of the people of Aceh Receiving Rohingya refugees is the same as bringing problems to themselves,0.0,0.137,0.863,-0.4019,already aware of the people of aceh receiving rohingya refugees is the same as bringing problems to themselv,Positif,Netral
1108,2023-11-17T02:31:47Z,@az4770,Sdh trll banyak jngn smp bikin susah sndr. Maaf,Already a lot dont make it difficult to make it difficult Excuse me,0.38,0.0,0.62,0.5454,already a lot dont make it difficult to make it difficult excuse m,Negatif,Netral
1109,2023-11-17T02:31:45Z,@kudaputih1275,"bela Rohingya,,, mereka kaum SE iman,,,, kok malah di tolak !???  <br>  bgaimana jikalau itu masyarakat palestina !??? <br>    wahhh pasti nyambutnya bgaikn pahlawan ,,,",Bela Rohingya  they are the people of faith  how come even rejected  br How about that Palestinian community  br wahhh definitely greeted him to the heroes ,0.298,0.079,0.623,0.846,bela rohingya they are the people of faith how come even rejected br how about that palestinian community br wahhh definitely greeted him to the hero,Netral,Netral
1110,2023-11-17T02:31:29Z,@syahninhananie9231,Ya Allah 😢,O Allah 😢,0.0,0.0,1.0,0.0,o allah,Netral,Netral
1111,2023-11-17T02:31:26Z,@isnaeni3454,"kalau kita kasih tinggal di indonesia...malah nanti jadi masalah...kadang sudah kasih ampla,mintak jantung....",If we give you living in Indonesia  In fact it will become a problem  sometimes I give you ampla ask your heart ,0.0,0.109,0.891,-0.4019,if we give you living in indonesia in fact it will become a problem sometimes i give you ampla ask your heart,Netral,Netral
1112,2023-11-17T02:31:15Z,@azharbudiman8272,Pengungsi itu orang susah coba sedikit berfikir dengan otak yang jernih janganlah kalian usir pengungsi tsb bantu mereka semampu kalian coba contoh hal itu kalian terjadi seperti mereka bagaimana sedihnya,Refugees are difficult people try to think a little with a clear brain Dont you expel the refugees help them as much as you can try the example that you happen like them how sad,0.233,0.132,0.635,0.5151,refugees are difficult people try to think a little with a clear brain dont you expel the refugees help them as much as you can try the example that you happen like them how sad,Negatif,Positif
1113,2023-11-17T02:31:04Z,@wariatunjampiroso570,YaAlloh krnapaditolak kasian,Yaalloh because it is rejected,0.0,0.452,0.548,-0.5106,yaalloh because it is reject,Netral,Netral
1114,2023-11-17T02:31:01Z,@user-hg8su1nf3v,Yg belum tau asli wataknya Rohingya dia pasti bilang kasian tp cobalah mengerti seperti negara&#39; jiran Singapura Thailand laos nepal di sana mereka menolaknya krn dia tau betul watak Rohingya klw dia di kasih hati dia akan berkuasa seperti sekarang di Malaysia dia menguasai lebih separoh perekonomian warga tempatan jd hati 2 dlm mengambil tindakan,Who do not know the original character of the Rohingya he must say sorry but try to understand like the country 39 The neighbor of Singapore Thailand Laos Nepal there they reject it because he knows very well the Rohingyas character Klw he is given his heart he will rule as now in Malaysia he controls more than half the economy,0.093,0.09,0.817,0.2866,who do not know the original character of the rohingya he must say sorry but try to understand like the country the neighbor of singapore thailand laos nepal there they reject it because he knows very well the rohingyas character klw he is given his heart he will rule as now in malaysia he controls more than half the economi,Positif,Positif
1115,2023-11-17T02:30:47Z,@owencawa8037,Lebih enak dorang masuk di negara kita. Kita aja masuk negara org susa skali ada yg kena tangkap bahakan sampai ada yg mati berpulu2 orang di laut. Itu bangsa mari dgn susa tapi klu suda 1 atau 2 tahu indonesia pun mereka bisa kuasa serupa sini Malaysia.,Its better to enter our country We just enter the country orgas there are those who get caught up until someone dies in the same people in the sea That is the nation with the Susa but if you have 1 or 2 know that Indonesia can be a similar power here Malaysia,0.038,0.0,0.962,0.2382,its better to enter our country we just enter the country orgas there are those who get caught up until someone dies in the same people in the sea that is the nation with the susa but if you have or know that indonesia can be a similar power here malaysia,Positif,Positif
1116,2023-11-17T02:30:41Z,@mazzaisariga5654,"Saya sebagai warga Aceh sangat setuju, kami bukan orang bodoh, alasan selalu terdampar, terdampar, klau memang terdampar kenapa selalu di Aceh terdampar nya, saya tidak suka jika daerah saya dijadikan tempat transit mereka untuk ke Malaysia dan tempat lain, selalu alasan terdampar🤔🤔🤔",I as Acehnese citizens strongly agree we are not fools the reason is always stranded stranded if we are stranded why in Aceh it is always stranded I do not like it if my area is used as a place to transit to Malaysia and other places always the reasons for stranded 🤔,0.131,0.038,0.831,0.6271,i as acehnese citizens strongly agree we are not fools the reason is always stranded stranded if we are stranded why in aceh it is always stranded i do not like it if my area is used as a place to transit to malaysia and other places always the reasons for strand,Positif,Positif
1117,2023-11-17T02:30:35Z,@roimansinaga9549,"Panggil saudara saudara mu lagi bung, siapa tau turun temurun jadi capres",Call your brother again man who knows hereditary becomes a presidential candidate,0.0,0.0,1.0,0.0,call your brother again man who knows hereditary becomes a presidential candid,Positif,Netral
1118,2023-11-17T02:30:31Z,@user-jo9mj6hf3y,"Tadi sponsor aqua, gitu kok di boikot.  Apa bedanya rohingya dan palestina kok rohingya di tolak padahal sekarang gencar gencar nya boikot plus bantuan palestina,  semisal orang palestina banyak yg ngungsi ke indonesia apa juga di tolak.  Mari saya kita mikir buat apa boykot pasti kesempatan untuk persaingan dagang. Keluar berapa trilliun",Earlier the Aqua sponsor how come it was boycotted What is the difference between Rohingya and Palestine the Rohingya are rejected even though now the incessant boycotts plus Palestinian assistance such as Palestinians who are displaced to Indonesia or what is also rejected Let me think of what Boykot is definitely an opportunity for trade competition How many trillion came out,0.076,0.162,0.762,-0.7351,earlier the aqua sponsor how come it was boycotted what is the difference between rohingya and palestine the rohingya are rejected even though now the incessant boycotts plus palestinian assistance such as palestinians who are displaced to indonesia or what is also rejected let me think of what boykot is definitely an opportunity for trade competition how many trillion came out,Positif,Positif
1119,2023-11-17T02:30:13Z,@mamadcabul_123,kita harus menerima sesama muslim adalah saudara bila mana perlu semua pengungsi palestina kita terima,We must accept fellow Muslims is a brother if we need all of our Palestinian refugees,0.157,0.0,0.843,0.3818,we must accept fellow muslims is a brother if we need all of our palestinian refug,Netral,Netral
1120,2023-11-17T02:29:54Z,@muhammadtaufik1494,Hati hati dulu pernah ada org diterima di Palestina malah diduduki,Be careful that there was a person who was accepted in Palestine even occupied,0.252,0.0,0.748,0.4019,be careful that there was a person who was accepted in palestine even occupi,Negatif,Netral
